"data","tipo_refeicao","Quarta-Feira 17/12/2025","Quinta-Feira 18/12/2025"
"2025-12-17_04:34:30.641074","Café da manhã","Pão de milho ou integral com patê de azeitona 
Opção vegana: pão de milho ou integral com patê de azeitona 
Maçã","Pão hot-dog ou integral com manteiga
Opção vegana: pão hot-dog ou integral com hommus
Melão"
"2025-12-17_04:34:30.641074","Almoço","Frango ao molho de tomate
Opção vegana: almôndega de grão de bico ao sugo 
Polenta cremosa 
Saladas de folhosa e pepino
Molho para saladas: vinagrete 
Salada de frutas","Estrogonofe de carne 
Opção vegana: estrogonofe de lentilha
Batata chips 
Saladas de folhosa e cenoura ralada 
Molho para saladas: vinagrete 
Salada de frutas"
"2025-12-17_04:34:30.641074","Jantar","Madalena de carne 
Opção vegana: madalena de lentilha 
Sopa de legumes com carne e arroz 
Saladas de folhosa e abobrinha ralada
Molho para saladas: molho tártaro","Frango xadrez 
Opção vegana: feijão fradinho chinês 
Creme de milho 
Saladas de folhosa e tomate 
Molho para saladas: vinagrete"
