"data","tipo_refeicao","Sexta-Feira 10/10/2025","Segunda-Feira 13/10/2025","Terça-Feira 14/10/2025"
"2025-10-10_22:18:19.754936","Café da manhã","Pão de cenoura com patê de frango 
Opção vegana: pão integral com patê de ervas 
Salada de frutas","Pão de hot-dog com ovo mexido 
Opção vegana: pão integral com patê de azeitona 
Maçã","Pão hot-dog patê de queijo 
Opção vegana: pão integral com patê de cenoura 
Mamão"
"2025-10-10_22:18:19.754936","Almoço","Barreado 
Opção vegana: pimentão recheado com ervilha seca 
Farofa de banana 
Saladas de folhosa  e berinjela cozida 
Molho de salada: molho tártaro","Bife acebolado 
Opção vegana: lentilha refogada 
Quibebe 
Saladas de folhosa  e beterraba ralada  
Molho para salada: molho de mostarda 
Tangerina","Carne moída com molho 
Opção vegana: croquete de feijão fradinho 
Creme de milho 
Saladas de folhosa  e abobrinha cozida 
Molho para salada: vinagrete 
Banana"
"2025-10-10_22:18:19.754936","Jantar","Lasanha á bolonhesa 
Opção vegana: Abobrinha recheada com proteína de soja 
Sopa juliana com arroz 
Saladas de folhosa  e repolho cozido
Molho para salada: vinagrete","Carne moída ao molho 
Opção vegana: PTS com couve 
Canja 
Saladas de folhosa  e tabule  
Molho para salada: vinagrete","Bisteca suína ao molho roty  
2ª opção: ovos mexidos à provençal 
Opção vegana: grão-de-bico ao molho mostarda 
Sopa de legumes com carne e arroz 
Saladas de folhosa  e macarronese 
Molho para salada: vinagrete"
