"data","tipo_refeicao","Quinta-Feira 30/10/2025","Sexta-Feira 31/10/2025","Segunda-Feira 03/11/2025"
"2025-10-30_20:21:04.466545","Café da manhã","Pão de milho ou integral com queijo 
Opção vegana: pão de milho ou integral com pasta de amendoim 
Bolo de chocolate 
Banana","Pão hot-dog ou integral com manteiga 
Opção vegana: pão hot-dog ou integral com patê de cenoura 
Melancia","Pão de cenoura ou integral com presunto 
Opção vegana: pão de cenoura ou integral com patê de azeitona 
Tangerina"
"2025-10-30_20:21:04.466545","Almoço","Goulash 
Opção vegana: PTS refogada com espinafre 
Aipim temperado  
Saladas de folhosa  e cenoura cozida 
Molho para salada: vinagrete 
Salada de frutas","Copa lombo ao molho rotty 
2ª opção: omelete de forno 
Opção vegana: goulash de lentilha 
Abobrinha refogada 
Saladas de folhosa  e pepino 
Molho para salada: vinagrete 
Surpresa de banana","Bisteca suína ao molho barbecue 
2ª opção: omelete de forno 
Opção vegana: grão-de-bico refogado 
Farofa de milho 
Saladas de folhosa  e beterraba ralada 
Molho para salada: vinagrete 
Maçã"
"2025-10-30_20:21:04.466545","Jantar","Iscas bovinas com legumes 
Opção vegana: ervilha com legumes 
Creme de aipim 
Saladas de folhosa  e beterraba cozida 
Molho para salada: molho de mostarda","Empadão de frango 
Opção vegana: empadão de feijão fradinho com legumes 
Sopa de carne à florentina 
Saladas de folhosa  e tomate 
Molho para salada: vinagrete","Iscas bovinas à chinesa 
Opção vegana: soja refogada
Sopa de abóbora 
Saladas de folhosa  e pepino 
Molho para salada: vinagrete"
