"data","tipo_refeicao","Segunda-Feira 03/11/2025","Terça-Feira 04/11/2025","Quarta-Feira 05/11/2025"
"2025-11-03_20:23:54.590698","Café da manhã","Pão de cenoura ou integral com presunto 
Opção vegana: pão de cenoura ou integral com patê de abacate 
Tangerina","Pão francês ou integral com ovos mexidos 
Opção vegana: pão francês ou integral com pasta de amendoim 
Mamão","Pão de milho ou integral com queijo 
Opção vegana: pão de milho ou integral com patê de ervas 
Laranja"
"2025-11-03_20:23:54.590698","Almoço","Bisteca suína ao molho barbecue 
2ª opção: omelete de forno 
Opção vegana: grão-de-bico refogado 
Farofa de milho 
Saladas de folhosa  e beterraba ralada 
Molho para salada: vinagrete 
Maçã","Carne moída refogada 
Opção vegana: hambúrguer de soja 
Repolho refogado 
Saladas de folhosa  e tabule 
Molho para salada: molho de mostarda 
Sagu de vinho","Poulet mwamba (frango)
Opção vegana: feijão cavalo refogado com pimentão e amendoim 
Fufu 
Saladas de folhosa  e pepino 
Molho para saladas: vinagrete 
Mamão"
"2025-11-03_20:23:54.590698","Jantar","Iscas bovinas à chinesa 
Opção vegana: soja refogada
Sopa de abóbora 
Saladas de folhosa  e pepino 
Molho para salada: vinagrete","Estrogonofe de frango 
Opção vegana: estrogonofe de feijão branco 
Batata chips 
Saladas de folhosa  e tomate 
Molho para salada: vinagrete","Bife à romanesca 
Opção vegana: grão-de-bico com curry 
Sopa de legumes com frango 
Saladas de folhosa  e berinjela 
Molho para saladas: molho de mostarda"
