"data","tipo_refeicao","Terça-Feira 16/12/2025","Quarta-Feira 17/12/2025","Quinta-Feira 18/12/2025"
"2025-12-16_16:24:20.987844","Café da manhã","Pão francês ou integral com queijo 
Opção vegana: pão francês ou integral com requeijão vegano
Banana","Pão de milho ou integral com patê de azeitona 
Opção vegana: pão de milho ou integral com patê de azeitona 
Maçã","Pão hot-dog ou integral com manteiga
Opção vegana: pão hot-dog ou integral com hommus
Melão"
"2025-12-16_16:24:20.987844","Almoço","Posta suína ao molho roty 
2ª opção: omelete de forno 
Opção vegana: lentilha refogada 
Abobrinha refogada 
Saladas de folhosa e beterraba ralada 
Molho para saladas: molho verde 
Delícia de abacaxi","Frango ao molho de tomate
Opção vegana: almôndega de grão de bico ao sugo 
Polenta cremosa 
Saladas de folhosa e pepino
Molho para saladas: vinagrete 
Salada de frutas","Estrogonofe de carne 
Opção vegana: estrogonofe de lentilha
Batata chips 
Saladas de folhosa e cenoura ralada 
Molho para saladas: vinagrete 
Salada de frutas"
"2025-12-16_16:24:20.987844","Jantar","Madalena de carne 
Opção vegana: madalena de lentilha 
Sopa de legumes com carne e arroz 
Saladas de folhosa e cenoura ralada 
Molho para saladas: vinagrete","Madalena de carne 
Opção vegana: madalena de lentilha 
Sopa de legumes com carne e arroz 
Saladas de folhosa e abobrinha ralada
Molho para saladas: molho tártaro","Frango xadrez 
Opção vegana: feijão fradinho chinês 
Creme de milho 
Saladas de folhosa e tomate 
Molho para saladas: vinagrete"
