"data","tipo_refeicao","Quarta-Feira 17/12/2025","Quinta-Feira 18/12/2025","Sexta-Feira 19/12/2025"
"2025-12-17_12:35:57.963804","Café da manhã","Pão de milho ou integral com patê de presunto 
Opção vegana: pão de milho ou integral com patê de azeitona 
Maçã","Pão hot-dog ou integral com manteiga
Opção vegana: pão hot-dog ou integral com hommus
Melão","Pão francês ou integral com ovos mexidos 
Opção vegana: pão francês ou integral com patê de espinafre 
Mamão"
"2025-12-17_12:35:57.963804","Almoço","Frango ao molho de tomate
Opção vegana: almôndega de grão de bico ao sugo 
Polenta cremosa 
Saladas de folhosa e pepino
Molho para saladas: vinagrete 
Salada de frutas","Estrogonofe de carne 
Opção vegana: estrogonofe de lentilha
Batata chips 
Saladas de folhosa e cenoura ralada 
Molho para saladas: vinagrete 
Salada de frutas","Filé de frango ao molho mostarda 
Opção vegana: hambúrguer de feijão branco à escabeche 
Repolho refogado 
Saladas de folhosa e berinjela 
Molho para saladas: molho tártaro 
Sagu de vinho"
"2025-12-17_12:35:57.963804","Jantar","Madalena de carne 
Opção vegana: madalena de lentilha 
Sopa de legumes com carne e arroz 
Saladas de folhosa e abobrinha ralada
Molho para saladas: molho tártaro","Frango xadrez 
Opção vegana: feijão fradinho chinês 
Creme de milho 
Saladas de folhosa e tomate 
Molho para saladas: vinagrete","Bife de panela  
Opção vegana: tomate recheado com PTS
Sopa de frango com macarrão 
Saladas de folhosa e russa 
Molho para saladas: vinagrete"
