"data","tipo_refeicao","Terça-Feira 14/10/2025","Quarta-Feira 15/10/2025"
"2025-10-14_08:24:21.538242","Café da manhã","Pão hot-dog com queijo muçarela 
Opção vegana: pão integral com requeijão vegano 
Mamão","Pão de milho com presunto
Opção vegana: pão integral com patê de grão-de-bico e beterraba 
Melão"
"2025-10-14_08:24:21.538242","Almoço","Carne moída com molho 
Opção vegana: croquete de feijão fradinho 
Creme de milho 
Saladas de folhosa  e abobrinha cozida 
Molho para salada: vinagrete 
Banana","Bisteca ao molho roty 
2ª opção: omelete de forno 
Opção vegana: charuto de grão-de-bico 
Legumes quentes 
Saladas de folhosa  e tomate 
Molho para salada: vinagrete 
Pudim de chocolate com bolacha"
"2025-10-14_08:24:21.538242","Jantar","Bisteca suína ao molho roty 
2ª opção: ovos mexidos à provençal 
Opção vegana: grão-de-bico ao molho mostarda 
Sopa de legumes com carne e arroz 
Saladas de folhosa  e macarronese 
Molho para salada: vinagrete","Bife de panela 
Opção vegana: moussaka feijão branco 
Sopa de frango com macarrão 
Saladas de folhosa  e beterraba ralada 
Molho para salada: molho tártaro"
