"data","tipo_refeicao","Segunda-Feira 05/01/2026","Terça-Feira 06/01/2026"
"2025-12-31_14:18:53.150984","Café da manhã","Pão francês com ovo mexido 
Opção: pão francês ou integral com pasta de abacate 
Maçã","Pão hot-dog com patê de presunto 
Opção: pão hot-dog ou integral com pasta de grão-de-bico com beterraba 
Melão"
"2025-12-31_14:18:53.150984","Almoço","Bife à pizzaiolo 
Opção vegana: hambúrguer de feijão cavalo à pizzaiolo 
Quirera com tempero verde 
Saladas de folhosa  e beterraba ralada 
Molho para salada: verde 
Melão","Filé de frango à canadense 
Opção vegana: tomate recheado com lentilha 
Abóbora refogada 
Saladas de folhosa  e rabanete 
Molho para salada: vinagrete 
Melancia"
"2025-12-31_14:18:53.150984","Jantar","Frango ao molho de laranja 
Opção vegana: bolinho de lentilha 
Sopa de feijão 
Saladas de folhosa  e cenoura ralada 
Molho para salada: vinagrete","Quibe de forma 
Opção vegana: quibe de PTS 
Sopa de raízes 
Saladas de folhosa  e berinjela 
Molho para salada: rosê"
