"data","tipo_refeicao","Segunda-Feira 17/11/2025","Terça-Feira 18/11/2025","Quarta-Feira 19/11/2025"
"2025-11-17_14:18:49.077663","Café da manhã","Pão de milho ou integral com presunto 
Opção vegana: pão de milho ou integral com pasta de amendoim 
Laranja","Pão francês ou integral com doce de leite
Opção vegana: pão francês ou integral com escabeche de berinjela 
Mamão","Pão hot-dog ou integral com queijo 
Opção vegana: pão hot-dog ou integral com patê de ervilha 
Maçã"
"2025-11-17_14:18:49.077663","Almoço","Bife à fricandole 
Opção vegana: hambúrguer de feijão cavalo 
Abobrinha colorida 
Saladas de folhosa  e tomate 
Molho para saladas: molho rosê 
Melão","Estrogonofe de frango 
Opção vegana: estrogonofe de feijão branco
Batata chips 
Saladas de folhosa e rabanete com cenoura 
Molho para salada: vinagrete 
Maçã","Barreado + farinha de mandioca 
Opção vegana: barreado de grão-de-bico 
Banana assada 
Saladas de folhosa e tropical 
Molho para saladas: vinagrete 
Laranja"
"2025-11-17_14:18:49.077663","Jantar","Frango ao molho de açafrão 
Opção vegana: bolinho de feijão fradinho 
Sopa de legumes com arroz 
Saladas de folhosa  e pepino 
Molho para saladas: vinagrete","Lasanha à bolonhesa 
Opção vegana: lasanha de lentinha
Sopa Juliana com arroz 
Saladas de folhosa e beterraba ralada 
Molho para salada: molho de mostarda","Bisteca ao molho barbecue 
Opção vegana: PTS ao molho escuro 
Sopa mineira
Saladas de folhosa e batata doce caramelizada 
Molho para saladas: vinagrete"
