"data","tipo_refeicao","Quarta-Feira 04/02/2026","Quinta-Feira 05/02/2026","Sexta-Feira 06/02/2026"
"2026-02-04_22:23:28.710428","Café da manhã","Pão de milho ou integral com presunto
Opção vegana: pão de cenoura ou integral com patê de inhame 
Melão","Pão hot-dog ou integral  com patê de frango 
Opção vegana: pão hot-dog ou integral com patê de azeitona vegano 
Salada de frutas","Pão francês ou integral com ovo mexido 
Opção vegana: pão francês ou integral com pasta de amendoim 
Abacaxi"
"2026-02-04_22:23:28.710428","Almoço","Frango com quiabo 
Opção vegana: lentilha com quiabo 
Quibebe 
Saladas de folhosa  e macarronese 
Molho para saladas: vinagrete 
Maçã","Carne moída à mexicana 
Opção vegana: chilli vegano 
Batata sautée 
Saladas de folhosa  e pepino 
Molho para saladas: molho rosê 
Mamão","Filé de frango na mostarda 
Opção vegana: hambúrguer de ervilha seca na mostarda 
Legumes refogados 
Saladas de folhosa  e tomate 
Molho para saladas: vinagrete 
Creme de abacate"
"2026-02-04_22:23:28.710428","Jantar","Bife à cigana 
Opção vegana: ervilha-seca com vagem 
Canja 
Saladas de folhosa  e berinjela com orégano 
Molho para saladas: mostarda","Espetinho de frango à milanesa 
Opção vegana: espetinho de bolinha de ervilha seca à milanesa 
Sopa de legumes com carne 
Saladas de folhosa  e chuchu 
Molho para saladas: vinagrete","Carne moída ao sugo 
Opção vegana: PTS ao sugo 
Sopa de creme de cebola 
Saladas de folhosa  e beterraba ralada 
Molho para saladas: molho tártaro"
