"data","tipo_refeicao","Quarta-Feira 06/05/2026","Quinta-Feira 07/05/2026","Sexta-Feira 08/05/2026"
"2026-05-07_02:14:46.38249","Café da manhã","Pão de milho ou integral com queijo 
Opção vegana: pão de milho ou integral com patê de ervas com inhame 
Melão","Pão hot-dog ou integral com patê de frango 
Opção vegana: pão hot-dog ou integral com patê de abacate 
Abacaxi","Pão francês ou integral com doce de leite 
Opção vegana: pão francês ou integral com hommus 
Salada de frutas com kiwi"
"2026-05-07_02:14:46.38249","Almoço","Frango com quiabo
Opção vegana: lentilha com quiabo 
Quibebe 
Saladas de folhosas  e macarronese 
Molho para saladas: vinagrete  
Tangerina Ponkan","Carne moída à mexicana 
Opção vegana: PTS com feijão branco refogados 
Batata amassada 
Saladas de folhosas  e pepino 
Molho para saladas: molho rosê 
Mamão","Filé de frango na mostarda 
Opção vegana: hambúrguer de ervilha-seca na mostarda 
Legumes refogados 
Saladas de folhosas  e tomate 
Molho para saladas: vinagrete 
Creme de chocolate"
"2026-05-07_02:14:46.38249","Jantar","Bife à cigana 
Opção vegana: grão-de-bico com vagem à cigana 
Sopa de abóbora com frango 
Saladas de folhosas  e berinjela com orégano 
Molho para saladas: molho mostarda","Espetinho de frango à milanesa 
Opção vegana: espetinho de bolinha de ervilha-seca à milanesa 
Sopa de legumes com carne 
Saladas de folhosas  e chuchu 
Molho para saladas: vinagrete","Carne moída ao sugo 
Opção vegana: PTS ao sugo 
Sopa de aipim 
Saladas de folhosas  e beterraba ralada 
Molho para saladas: molho tártaro"
