"data","tipo_refeicao","Sexta-Feira 08/05/2026","Segunda-Feira 11/05/2026"
"2026-05-08_07:21:53.39421","Café da manhã","Pão francês ou integral com doce de leite 
Opção vegana: pão francês ou integral com hommus 
Salada de frutas com kiwi","Pão francês ou integral com queijo 
Opção vegana: pão francês ou integral com escabeche de berinjela 
Mamão"
"2026-05-08_07:21:53.39421","Almoço","Filé de frango na mostarda 
Opção vegana: hambúrguer de ervilha-seca na mostarda 
Legumes refogados 
Saladas de folhosas  e tomate 
Molho para saladas: vinagrete 
Creme de chocolate","Bife à gaúcha 
Opção vegana: lentilha com vagem ao sugo 
Virado de couve 
Saladas de folhosas  e cenoura ralada 
Molho para saladas: molho mostarda 
Maçã"
"2026-05-08_07:21:53.39421","Jantar","Carne moída ao sugo 
Opção vegana: PTS ao sugo 
Sopa de aipim 
Saladas de folhosas  e beterraba ralada 
Molho para saladas: molho tártaro","Frango assado com alecrim 
Opção vegana: torre de berinjela com pasta de feijão branco 
Sopa creme de milho 
Saladas de folhosas  e tomate 
Molho para saladas: vinagrete"
