"data","tipo_refeicao","Quinta-Feira 22/01/2026","Sexta-Feira 23/01/2026"
"2026-01-23_01:15:27.580099","Café da manhã","Pão hot-dog com ovo mexido 
Opção: pão hot-dog ou integral com pasta de ervilha-seca 
Salada de frutas","Pão de milho com patê de cenoura 
Opção: pão de milho ou integral com manteiga 
Maçã"
"2026-01-23_01:15:27.580099","Almoço","Peixe à milanesa 
Opção vegana: croquete de soja 
Cenoura com acelga à moda chinesa 
Saladas de folhosa  e tomate 
Molho para salada: verde 
Abacaxi","Bife acebolado 
Opção vegana: hambúrguer de feijão branco com páprica 
Creme de brócolis 
Saladas de folhosa  e abobrinha cozida 
Molho para salada: vinagrete 
Mamão"
"2026-01-23_01:15:27.580099","Jantar","Bife à fantasia 
Opção vegana: croquete de soja 
Caldo verde 
Saladas de folhosa  e tomate 
Molho para salada: vinagrete","Espetinho de frango 
Opção vegana: espetinho de bolinha de ervilha-seca à milanesa 
Sopa leve 
Saladas de folhosa  e mista cozida 
Molho para salada: rosê"
