"data","tipo_refeicao","Segunda-Feira 11/05/2026","Terça-Feira 12/05/2026"
"2026-05-10_02:26:11.340608","Café da manhã","Pão francês ou integral com queijo 
Opção vegana: pão francês ou integral com escabeche de berinjela 
Mamão","Pão hot-dog ou integral com ovo mexido 
Opção vegana: pão hot-dog ou integral com hommus 
Maçã"
"2026-05-10_02:26:11.340608","Almoço","Bife à gaúcha 
Opção vegana: lentilha com vagem ao sugo 
Virado de couve 
Saladas de folhosas  e cenoura ralada 
Molho para saladas: molho mostarda 
Maçã","Frango assado na laranja 
Opção vegana: madalena de feijão cavalo 
Ratatouille 
Saladas de folhosas  e rabanete 
Molho para saladas: vinagrete 
Torta de amendoim"
"2026-05-10_02:26:11.340608","Jantar","Frango assado com alecrim 
Opção vegana: torre de berinjela com pasta de feijão branco 
Sopa creme de milho 
Saladas de folhosas  e tomate 
Molho para saladas: vinagrete","Bife ao molho com cenoura e bacon 
Opção vegana: canelone recheado com ervilha-seca 
Sopa de legumes com macarrão 
Saladas de folhosas  e vagem com cenoura e milho 
Molho para saladas: vinagrete"
