"data","tipo_refeicao","Sexta-Feira 30/01/2026","Segunda-Feira 02/02/2026"
"2026-01-30_18:36:28.149355","Café da manhã","Pão hot-dog com queijo 
Opção: pão hot-dog ou integral com pasta de inhame 
Abacaxi","Pão de cenoura ou integral com patê de queijo 
Opção vegana: pão de cenoura ou integral com pasta de abacate 
Maçã"
"2026-01-30_18:36:28.149355","Almoço","Frango crocante 
Opção vegana: hambúrguer de feijão cavalo 
Ratatouille 
Saladas de folhosa  e beterraba ralada 
Molho para salada: vinagrete 
Canjica","Bisteca ao molho barbecue 
2ª opção: omelete de forno 
Opção vegana: grão-de-bico ao molho barbecue 
Quirera com costelinha 
Saladas de folhosa e beterraba ralada 
Molho para saladas: vinagrete 
Laranja"
"2026-01-30_18:36:28.149355","Jantar","Posta assada 
Opção vegana: abobrinha à rolê com pasta de feijão cavalo 
Sopa primavera 
Saladas de folhosa  e pepino 
Molho para salada: verde","Carne ao curry 
Opção vegana: Soja com batata ao curry
Sopa de creme de abóbora com gengibre 
Saladas de folhosa e pepino 
Molho para saladas: vinagrete"
