"data","tipo_refeicao","Segunda-Feira 01/06/2026","Terça-Feira 02/06/2026","Quarta-Feira 03/06/2026"
"2026-05-30_13:13:32.13996","Café da manhã","Pão hot-dog ou integral com patê de cenoura com ervas 
Opção vegana: pão hot-dog ou integral com patê de cenoura com ervas vegano 
Maçã","Pão francês ou integral com queijo 
Opção vegana: pão francês ou integral com pasta de ervilha-seca 
Laranja","Pão de milho ou integral com patê de frango 
Opção vegana: pão de milho ou integral com patê de azeitona vegano 
Salada de frutas"
"2026-05-30_13:13:32.13996","Almoço","Bisteca à cigana 
2ª opção: ovo à provençal 
Opção vegana: ervilha-seca ao molho de tomate 
Repolho refogado 
Saladas de folhosas  e cenoura ralada 
Molho para saladas: vinagrete","Carne moída ao sugo 
Opção vegana: almôndega de lentilha ao sugo 
Aipim com tempero verde 
Saladas de folhosas  e pepino 
Molho para saladas: vinagrete 
Pudim de chocolate com calda de caramelo","Frango xadrez 
Opção vegana: grão-de-bico xadrez 
Macarrão na manteiga 
Saladas de folhosas  e rabanete com milho 
Molho para saladas: vinagrete 
Maçã"
"2026-05-30_13:13:32.13996","Jantar","Carne moída especial 
Opção vegana: PTS especial 
Caldo Italiano 
Saladas de folhosas  e beterraba ralada 
Molho para saladas: vinagrete","Frango ao curry 
Opção vegana: grão-de-bico ao curry 
Sopa de legumes com arroz 
Saladas de folhosas  e cenoura cozida 
Molho para saladas: vinagrete","Barreado/farinha de mandioca 
Opção vegana: barreado de ervilha-seca com cenoura e cominho 
Banana assada 
Saladas de folhosas  e abobrinha cozida 
Molho para saladas: vinagrete"
