"data","tipo_refeicao","Quinta-Feira 23/04/2026","Sexta-Feira 24/04/2026"
"2026-04-23_11:06:36.1255","Café da manhã","Pão de cenoura ou integral com patê de queijo 
Opção vegana: pão de cenoura ou integral com pasta de amendoim 
Salada de frutas","Pão de milho ou integral com patê de frango 
Opção vegana: pão de milho ou integral com pasta de ervilha-seca 
Melão"
"2026-04-23_11:06:36.1255","Almoço","Frango assado ao açafrão 
Opção vegana: nuggets de grão-de-bico 
Ratatouille 
Saladas de folhosas  e caipira 
Molho para saladas: molho especial de cenoura 
Maçã","Estrogonofe de carne 
Opção vegana; estrogonofe de soja 
Batata chips 
Saladas de folhosas  e outono 
Molho para salada: vinagrete 
Fruta"
"2026-04-23_11:06:36.1255","Jantar","Bife acebolado 
Opção vegana: coxinha de PTS com azeitona 
Sopa da casa 
Saladas de folhosas  e vagem com cenoura 
Molho para saladas: vinagrete","Filé de frango no limão 
Opção vegana: moqueca de banana com feijão branco 
Sopa juliana com arroz 
Saladas de folhosas  e tomate 
Molho para salada: molho verde"
