"data","tipo_refeicao","Segunda-Feira 15/06/2026","Terça-Feira 16/06/2026"
"2026-06-14_11:51:59.067024","Café da manhã","Pão hot-dog ou integral com manteiga 
Opção vegana: pão hot-dog ou integral com patê de cenoura vegano
Tangerina Ponkan","Pão francês ou integral com patê de frango 
Opção vegana: pão francês ou integral com pasta de inhame com alho 
Banana"
"2026-06-14_11:51:59.067024","Almoço","Bife ao molho barbecue 
Opção vegana: ervilha-seca com batata doce ao molho barbecue
Farofa de milho 
Saladas de folhosa e nabo ralado 
Molho para saladas: vinagrete 
Mamão","Copa lombo ao molho ferrugem 
2ª opção: omelete de forno 
Opção vegana: tomate recheado com quinoa, vagem e milho 
Ratatouille 
Saladas de folhosos e beterraba ralada 
Molho para saladas: vinagrete 
Torta de bolacha"
"2026-06-14_11:51:59.067024","Jantar","Copa lombo à cigana 
2ª opção: ovos à provençal 
Opção vegana: PTS com couve-flor e ervilha ao sugo 
Sopa minestrone 
Saladas de folhosa e rabanete 
Molho para saladas: molho rosê","Frango assado com alecrim  
Opção vegana: falafel 
Sopa karê 
Saladas de folhosos e cenoura ralada 
Molho para saladas: vinagrete"
