"data","tipo_refeicao","Terça-Feira 24/03/2026","Quarta-Feira 25/03/2026"
"2026-03-24_16:57:26.421803","Café da manhã","Pão hot-dog ou integral com manteiga
Opção vegana: pão hot-dog ou integral com escabeche de berinjela 
Melão","Pão francês ou integral com patê de frango 
Opção vegana: pão francês ou integral com pasta da abacate 
Bolo de laranja 
Mamão"
"2026-03-24_16:57:26.421803","Almoço","Fricassê de frango 
Opção vegana: fricassê de ervilha-seca 
Arroz crocante 
Saladas de folhosas  e pepino  
Molho para saladas: vinagrete 
Gelatina de cereja","Barreado 
Opção vegana: grão-de-bico com legumes e cominho 
Farofa de banana 
Saladas de folhosas  e beterraba cozida 
Molho para saladas: vinagrete 
Abacaxi"
"2026-03-24_16:57:26.421803","Jantar","Goulash 
Opção vegana: goulash de grão-de-bico 
Sopa Califórnia 
Saladas de folhosas  e rabanete  
Molho para saladas: molho mostarda","Filé de peixe empanado 
Opção vegana: escondidinho de lentilha 
Sopa londrina 
Saladas de folhosas  e berinjela ao vinagrete 
Molho para saladas: vinagrete"
