"data","tipo_refeicao","Terça-Feira 02/06/2026","Quarta-Feira 03/06/2026"
"2026-06-02_08:23:36.796701","Café da manhã","Pão francês ou integral com queijo 
Opção vegana: pão francês ou integral com pasta de ervilha-seca 
Laranja","Pão de milho ou integral com patê de frango 
Opção vegana: pão de milho ou integral com patê de azeitona vegano 
Salada de frutas"
"2026-06-02_08:23:36.796701","Almoço","Carne moída ao sugo 
Opção vegana: almôndega de lentilha ao sugo 
Aipim com tempero verde 
Saladas de folhosas  e pepino 
Molho para saladas: vinagrete 
Pudim de chocolate com calda de caramelo","Filé de frango ao molho de pimentão 
Opção vegana: grão-de-bico com olho de pimentão 
Macarrão na manteiga 
Saladas de folhosas  e rabanete com milho 
Molho para saladas: vinagrete 
Maçã"
"2026-06-02_08:23:36.796701","Jantar","Frango ao curry 
Opção vegana: grão-de-bico ao curry 
Sopa de legumes com arroz 
Saladas de folhosas  e cenoura cozida 
Molho para saladas: vinagrete","Barreado/farinha de mandioca 
Opção vegana: barreado de ervilha-seca com cenoura e cominho 
Banana assada 
Saladas de folhosas  e abobrinha cozida 
Molho para saladas: vinagrete"
