"data","tipo_refeicao","Segunda-Feira 06/04/2026","Terça-Feira 07/04/2026"
"2026-04-05_01:55:33.635921","Café da manhã","Pão francês ou integral com presunto 
Opção vegana: pão francês ou integral com pasta de amendoim 
Caqui","Pão de milho ou integral com manteiga 
Opção vegana: pão de milho ou integral com doce de banana 
Abacaxi"
"2026-04-05_01:55:33.635921","Almoço","Picadinho de carne com ervilha 
Opção vegana: torre de abobrinha com pasta de feijão branco e tomate 
Virado de cenoura 
Saladas de folhosas  e tomate 
Molho para saladas: vinagrete 
Melão","Frango assado 
Opção vegana: madalena de ervilha-seca 
Repolho refogado 
Saladas de folhosas  e cenoura cozida 
Molho para saladas: molho verde 
Laranja"
"2026-04-05_01:55:33.635921","Jantar","Frango assado com quiabo 
Opção vegana: ervilha-seca com quiabo ao sugo 
Sopa mineira 
Saladas de folhosas  e beterraba ralada 
Molho para saladas: molho mostarda","Bife à milanesa 
Opção vegana: nuggets de soja 
Sopa de raízes 
Saladas de folhosas  e rabanete 
Molho para saladas: vinagrete"
