"data","tipo_refeicao","Segunda-Feira 23/02/2026","Terça-Feira 24/02/2026","Quarta-Feira 25/02/2026"
"2026-02-22_18:33:36.820857","Café da manhã","Pão francês com queijo 
Opção vegana: pão francês ou integral com patê de ervas vegano 
Maçã","Pão hot-dog com presunto 
Opção vegana: pão hot-dog ou integral com pasta de amendoim 
Melancia","Pão francês com ovo mexido 
Opção vegana: pão francês ou integral com patê de cenoura vegano 
Bolo formigueiro 
Laranja"
"2026-02-22_18:33:36.820857","Almoço","Carne moída ao sugo 
Opção vegana: chilli vegano 
Macarrão na manteiga 
Saladas de folhosa  e beterraba ralada 
Molho para salada: vinagrete 
Mamão","Peixe no fubá com limão 
Opção vegana: nuggets de ervilha-seca 
Jardineira de legumes 
Saladas de folhosa  e rabanete agridoce 
Molho para salada: molho mostarda 
Gelflan de cereja","Estrogonofe de carne 
Opção vegana: estrogonofe de lentilha 
Batata chips 
Saladas de folhosa  e tomate 
Molho para salada: vinagrete 
Melão"
"2026-02-22_18:33:36.820857","Jantar","Peixe à milanesa 
Opção vegana: cuscuz vegano com ervilha-seca 
Sopa de carne com legumes 
Saladas de folhosa  e tomate 
Molho para salada: molho rosê","Bife à pizzaiolo 
Opção vegana: abobrinha recheada com lentilha 
Creme Rio Branco 
Saladas de folhosa  e chuchu com tempero verde 
Molho para salada: vinagrete","Frango assado 
Opção vegana: quibe de quinoa com PTS e abóbora 
Sopa de feijão 
Saladas de folhosa  e salpicão de legumes 
Molho para salada: vinagrete"
